{
  "id": "design-thinking",
  "name": "Design Thinking",
  "description": "Human-centered approach to innovation that integrates user needs, technology possibilities, and business requirements",
  "category": "user-centric",
  "subcategory": "innovation-process",
  "difficulty": "intermediate",
  "estimated_time": "60-120 minutes",
  "structure": [
    {
      "name": "Empathize",
      "description": "Understand user needs, behaviors, and motivations through observation and engagement"
    },
    {
      "name": "Define",
      "description": "Clearly articulate the core problem and user needs based on empathy insights"
    },
    {
      "name": "Ideate",
      "description": "Generate a wide range of potential solutions through creative brainstorming"
    },
    {
      "name": "Prototype",
      "description": "Create low-fidelity representations to test ideas and gather feedback"
    },
    {
      "name": "Test",
      "description": "Validate solutions with real users and refine based on feedback"
    }
  ],
  "prompts": [
    "Who are we solving for and what do they truly need?",
    "What patterns emerged from user research and observation?",
    "What is the core problem we're trying to solve based on user insights?",
    "How might we address this problem from multiple angles?",
    "What's the simplest way to test our core assumptions?",
    "What did we learn from user testing and how should we iterate?",
    "What are the key insights that will guide our solution?"
  ],
  "when_to_use": [
    "Product development and feature design",
    "Service design and customer experience improvement",
    "Problem-solving for user-centered challenges",
    "Innovation workshops and creative sessions",
    "User research synthesis and insight generation",
    "Process improvement focusing on user experience"
  ],
  "when_not_to_use": [
    "Purely technical optimization problems",
    "Decisions with clear quantitative solutions",
    "Highly regulated environments requiring strict compliance",
    "Time-critical emergency decisions"
  ],
  "examples": [
    {
      "title": "Mobile App Redesign",
      "description": "Using Design Thinking to completely redesign a mobile banking app based on user research"
    },
    {
      "title": "Service Process Improvement",
      "description": "Redesigning customer onboarding process through empathy mapping and prototyping"
    },
    {
      "title": "Product Feature Innovation",
      "description": "Developing new collaboration features through iterative testing with remote teams"
    }
  ],
  "tags": ["design", "innovation", "user-centered", "creativity", "prototyping", "empathy"],
  "metadata": {
    "version": "1.0.0",
    "author": "IDEO and Stanford d.school",
    "quality_level": "core",
    "created_date": "2024-01-01T00:00:00Z",
    "last_updated": "2024-01-01T00:00:00Z",
    "validation_status": {
      "validated_by": "UX Research Expert",
      "validation_date": "2024-01-01T00:00:00Z",
      "validation_notes": "Proven methodology used by leading design firms and innovation labs worldwide",
      "effectiveness_rating": 5
    },
    "usage_stats": {
      "total_uses": 0,
      "user_satisfaction": 0,
      "completion_rate": 0
    }
  },
  "prerequisites": [
    "Access to users or user research data",
    "Open mindset for creative exploration",
    "Willingness to iterate based on feedback",
    "Time for user testing and validation"
  ],
  "related_frameworks": [
    "empathy-mapping",
    "user-journey-mapping",
    "jobs-to-be-done",
    "rapid-prototyping"
  ]
}
