{
  "id": "systems-thinking",
  "name": "Systems Thinking",
  "description": "Holistic approach to understanding complex problems by analyzing interconnections, patterns, and system dynamics",
  "category": "analytical",
  "subcategory": "complexity-analysis",
  "difficulty": "advanced",
  "estimated_time": "60-90 minutes",
  "structure": [
    {
      "name": "System Boundaries",
      "description": "Define what's inside and outside the system being analyzed"
    },
    {
      "name": "Key Components",
      "description": "Identify the major elements, actors, and resources in the system"
    },
    {
      "name": "Relationships and Interconnections",
      "description": "Map how components interact and influence each other"
    },
    {
      "name": "Feedback Loops",
      "description": "Identify reinforcing and balancing feedback loops that drive system behavior"
    },
    {
      "name": "Leverage Points",
      "description": "Find points where small changes can create significant system improvements"
    }
  ],
  "prompts": [
    "What are the boundaries of this system? What's included and excluded?",
    "Who are the key actors, and what are their roles and motivations?",
    "How do different parts of the system influence each other?",
    "What feedback loops exist that reinforce or balance system behavior?",
    "Where are the leverage points that could create disproportionate impact?",
    "What patterns emerge when we look at the system as a whole?",
    "How might changes in one area affect the entire system?"
  ],
  "when_to_use": [
    "Complex organizational or social problems",
    "Analyzing ecosystem dynamics and market structures",
    "Understanding root causes of persistent issues",
    "Designing interventions that account for system complexity",
    "Policy analysis and strategic planning",
    "Solving wicked problems with many interrelated factors"
  ],
  "when_not_to_use": [
    "Simple, linear problems with clear cause and effect",
    "Urgent decisions requiring immediate action",
    "Highly technical problems with well-defined parameters",
    "Situations where quick fixes are more important than deep understanding"
  ],
  "examples": [
    {
      "title": "Organizational Culture Change",
      "description": "Using systems thinking to understand how cultural patterns reinforce each other and identify intervention points"
    },
    {
      "title": "Supply Chain Optimization",
      "description": "Analyzing how supply chain disruptions create cascading effects across the entire business system"
    },
    {
      "title": "Digital Transformation Strategy",
      "description": "Mapping how technology changes create feedback loops affecting business processes and customer behavior"
    }
  ],
  "tags": [
    "complexity",
    "holistic",
    "interconnections",
    "patterns",
    "feedback",
    "ecosystem"
  ],
  "metadata": {
    "version": "1.0.0",
    "author": "Peter Senge and Systems Thinking Community",
    "quality_level": "core",
    "created_date": "2024-01-01T00:00:00Z",
    "last_updated": "2024-01-01T00:00:00Z",
    "validation_status": {
      "validated_by": "Systems Thinking Expert",
      "validation_date": "2024-01-01T00:00:00Z",
      "validation_notes": "Fundamental methodology for understanding complexity in business, policy, and social systems",
      "effectiveness_rating": 5
    },
    "usage_stats": {
      "total_uses": 0,
      "user_satisfaction": 0,
      "completion_rate": 0
    }
  },
  "prerequisites": [
    "Ability to see the bigger picture beyond immediate issues",
    "Patience for deep analysis without rushing to solutions",
    "Understanding of cause and effect relationships",
    "Comfort with complexity and uncertainty"
  ],
  "related_frameworks": [
    "root-cause-analysis",
    "stakeholder-analysis",
    "iceberg-model",
    "causal-loop-diagrams"
  ]
}