{
  "id": "decision-matrix",
  "name": "Decision Matrix Analysis",
  "description": "Systematic approach to comparing multiple options against weighted criteria to make data-driven decisions",
  "category": "analytical",
  "subcategory": "multi-criteria-decision",
  "difficulty": "intermediate",
  "estimated_time": "45-90 minutes",
  "structure": [
    {
      "name": "Options Identification",
      "description": "List all viable alternatives being considered"
    },
    {
      "name": "Criteria Definition",
      "description": "Define the evaluation criteria that matter for this decision"
    },
    {
      "name": "Criteria Weighting",
      "description": "Assign relative importance weights to each criterion"
    },
    {
      "name": "Option Scoring",
      "description": "Score each option against each criterion using consistent scale"
    },
    {
      "name": "Weighted Analysis",
      "description": "Calculate weighted scores and analyze the results"
    },
    {
      "name": "Sensitivity Analysis",
      "description": "Test how changes in weights affect the recommendation"
    }
  ],
  "prompts": [
    "What are all viable options we're considering for this decision?",
    "What criteria should we use to evaluate these options?",
    "How important is each criterion relative to others? (assign weights)",
    "How does each option perform against each criterion? (score 1-10)",
    "What do the weighted scores tell us about the best option?",
    "How sensitive is our recommendation to weight changes?",
    "Are there any qualitative factors not captured in our scoring?"
  ],
  "when_to_use": [
    "Vendor selection and procurement decisions",
    "Technology stack or tool selection",
    "Feature prioritization and roadmap planning",
    "Hiring decisions with multiple candidates",
    "Location or facility selection",
    "Investment or project portfolio decisions"
  ],
  "when_not_to_use": [
    "Decisions with only two clear options",
    "Time-critical decisions requiring immediate action",
    "Highly intuitive or creative decisions",
    "Situations where criteria cannot be clearly defined"
  ],
  "examples": [
    {
      "title": "Cloud Provider Selection",
      "description": "Comparing AWS, Azure, and GCP using criteria like cost, performance, compliance, and vendor lock-in"
    },
    {
      "title": "Software Tool Evaluation",
      "description": "Choosing between project management tools based on features, pricing, integration, and team adoption"
    },
    {
      "title": "Office Location Decision",
      "description": "Evaluating office locations using cost, accessibility, talent pool, and company culture fit criteria"
    }
  ],
  "tags": ["decision", "analysis", "comparison", "weighted", "criteria", "data-driven"],
  "metadata": {
    "version": "1.0.0",
    "author": "Decision Science Community",
    "quality_level": "extended",
    "created_date": "2024-01-01T00:00:00Z",
    "last_updated": "2024-01-01T00:00:00Z",
    "validation_status": {
      "validated_by": "Business Analyst",
      "validation_date": "2024-01-01T00:00:00Z",
      "validation_notes": "Standard approach for multi-criteria decision making in business and engineering",
      "effectiveness_rating": 4
    },
    "usage_stats": {
      "total_uses": 0,
      "user_satisfaction": 0,
      "completion_rate": 0
    }
  },
  "prerequisites": [
    "Clear decision criteria that can be measured or evaluated",
    "Multiple viable options to compare",
    "Stakeholder agreement on evaluation criteria",
    "Time for thorough analysis and scoring"
  ],
  "related_frameworks": [
    "cost-benefit-analysis",
    "pros-cons-analysis",
    "weighted-scoring",
    "trade-off-analysis"
  ]
}
